id,imdb_title_id,title,original_title,year,date_published,genre,duration,country,language,director,writer,production_company,actors,description,avg_vote,votes,budget,usa_gross_income,worlwide_gross_income,metascore,reviews_from_users,reviews_from_critics,lead_actors,y
905,tt8881102,sweethearts,sweethearts,2019,14/02/2019,"comedy, crime, romance",107,germany,german,karoline herfurth,monika fäßler,warner bros. film productions germany,"karoline herfurth, hannah herzsprung, anneke kim sarnau, frederick lau, ronald zehrfeld, luna arwen krüger, frederic linkemann, david schütter, mona pirzad, nilam farooq, ruby o. fee, uwe preuss, david bredin, jascha rust, katrin saß","forced together by fate and an ill-executed diamond robbery, professional criminal mel and her easily-panicked hostage franny are in a race against time. soon pursued by a relentless ...",6,207,,,$ 578423,,,8,"karoline herfurth, hannah herzsprung, anneke k","im sarnau, frederick lau, ronald zehrfeld, luna arwen krüger, frederic linkemann, david schütter, mona pirzad, nilam farooq, ruby o. fee, uwe preuss, david bredin, jascha rust, katrin saß"
906,tt8890582,mata batin 2,mata batin 2,2019,17/01/2019,"horror, mystery, thriller",116,indonesia,indonesian,rocky soraya,"riheam junianti, rocky soraya",hitmaker studios,"jessica mila, nabilah ratna ayu azalia, sophia latjuba, jeremy thomas, bianca hello, citra prima, jelita callebaut, hadijah shahab, nicole rossi, yasmine mahya, davina karamoy","alia is now working and living at an orphanage, where she meets a girl who also possesses inner eyes like her.",5.5,288,,,,,3,9,"jessica mila, nabilah ratna ayu azalia, sophia latju","ba, jeremy thomas, bianca hello, citra prima, jelita callebaut, hadijah shahab, nicole rossi, yasmine mahya, davina karamoy"
907,tt8896762,pilsudski,pilsudski,2019,26/09/2019,"biography, history",108,poland,polish,michal rosa,michal rosa,studio filmowe kadr,"borys szyc, magdalena boczarska, jan marczewski, maria debska, józef pawlowski, tomasz schuchardt, eliza rycembel, marcin hycnar, filip kosior, kamil szeptycki, tomasz borkowski, grzegorz malecki, krzysztof stroinski, przemyslaw bluszcz, lukasz garlicki","the year 1901, a psychiatric hospital in the russian partition. one of the patients is a political prisoner -",5.1,122,,,$ 1034548,,2,,"borys szyc, magdalena boczarska, jan marczewski, mar","ia debska, józef pawlowski, tomasz schuchardt, eliza rycembel, marcin hycnar, filip kosior, kamil szeptycki, tomasz borkowski, grzegorz malecki, krzysztof stroinski, przemyslaw bluszcz, lukasz garlicki"
908,tt8897986,family of thakurganj,family of thakurganj,2019,19/07/2019,"action, drama",127,india,hindi,"manoj k. jha, prince singh",dilip shukla,lovely world entertainment,"jimmy sheirgill, mahie gill, nandish singh, pranati rai prakash, saurabh shukla, sudhir pandey, supriya pilgaonkar, pavan malhotra, yashpal sharma, mukesh tiwari, raj zutshi, salil acharya, shivika rishi, lokesh tilakdhari, priya mishra",the film is based on small town of north india. film's story is about confrontation of love and thoughts. along with entertainment.,9.4,897,,,,,11,4,"jimmy sheirgill, mahie gill, nandish singh, pran","ati rai prakash, saurabh shukla, sudhir pandey, supriya pilgaonkar, pavan malhotra, yashpal sharma, mukesh tiwari, raj zutshi, salil acharya, shivika rishi, lokesh tilakdhari, priya mishra"
909,tt8898812,rate your date,rate your date,2019,07/03/2019,comedy,110,germany,german,david dietl,"david dietl, katharina eyssen",sevenpictures film,"marc benjamin, nilam farooq, edin hasanovic, alicia von rittberg, tito achikeh, eugen bauder, konstantin bez, raban bieling, lisa bitter, rainer bock, stephan buschmann, anke engelke, farina flebbe, frederik götz, jens hartwig",,5.4,113,eur 3800000,,$ 644155,,1,13,"marc benjamin, nilam farooq, edin hasanovic, alici","a von rittberg, tito achikeh, eugen bauder, konstantin bez, raban bieling, lisa bitter, rainer bock, stephan buschmann, anke engelke, farina flebbe, frederik götz, jens hartwig"
910,tt8902990,the sky is pink,the sky is pink,2019,11/10/2019,"drama, family, romance",143,"india, uk, canada, usa","english, hindi",shonali bose,"shonali bose, nilesh maniyar",ivanhoe pictures,"zaira wasim, priyanka chopra, farhan akhtar, rohit saraf, sudhanva deshpande, sammy john heaney, ishan jotshi, brian nathan, eshaan phadnis, gurpal singh","it is based on the love story of a couple spanning 25 years, told through the lens of their spunky teenage daughter aisha chaudhary, who was diagnosed with a pulmonary fibrosis .",6.6,1671,,$ 652592,$ 1088641,55,103,25,"zaira wasim, priyanka chopra, farhan akhtar, rohit","saraf, sudhanva deshpande, sammy john heaney, ishan jotshi, brian nathan, eshaan phadnis, gurpal singh"
911,tt8903840,alice et le maire,alice et le maire,2019,02/10/2019,"comedy, drama",103,"france, belgium",french,nicolas pariser,nicolas pariser,bizibi,"fabrice luchini, anaïs demoustier, nora hamzawi, léonie simaga, antoine reinartz, maud wyler, alexandre steiger, pascal rénéric, thomas rortais, thomas chabrol, michel valls, claire galopin, manon kneusé, lucie gallo, pierre desmaret","the mayor of lyon is in existential crisis. after 30 years in politics, he feels totally empty and devoid of ideas. as a fix for this problem, his aides bring a brilliant young philosopher, into his inner circle.",6.6,312,,,$ 5217754,,2,7,"fabrice luchini, anaïs demoustier, nora hamzawi,","léonie simaga, antoine reinartz, maud wyler, alexandre steiger, pascal rénéric, thomas rortais, thomas chabrol, michel valls, claire galopin, manon kneusé, lucie gallo, pierre desmaret"
912,tt8906022,modalità aereo,modalità aereo,2019,21/02/2019,comedy,100,italy,italian,fausto brizzi,"fausto brizzi, herbert simone paragnani",casanova multimedia,"violante placido, sabrina salerno, veronica logan, luca vecchi, paolo ruffini, dian biemans, caterina guzzanti, dino abbrescia, pasquale petrolo, christian monaldi, matt deluise, fabrizio nardi, matthijs ten kate, nico di renzo, juan gomez ocampo","diego is a successful entrepreneur. rich and not caring for the good of others, no scruples to belittle the next. his attitude turns against him when he forgets in his airport bathroom his ...",5.6,188,,,$ 1548450,,,3,"violante placido, sabrina salerno, veronica logan, lu","ca vecchi, paolo ruffini, dian biemans, caterina guzzanti, dino abbrescia, pasquale petrolo, christian monaldi, matt deluise, fabrizio nardi, matthijs ten kate, nico di renzo, juan gomez ocampo"
913,tt8907970,kavacha,kavacha,2019,05/04/2019,thriller,160,india,kannada,gvr vasu,m.s. ramesh,hayagriva movie adishtana,"iti acharya, joy badlani, dhritiman chatterjee, isha koppikar, shivarajkumar, vasishta n. simha","a blind man bonds with a young girl, and would go to great lengths to protect her from a serial killer.",8.4,559,,,,,5,1,"iti acharya, joy badlani, dhritiman chatterjee, isha","koppikar, shivarajkumar, vasishta n. simha"
914,tt8908002,luka chuppi,luka chuppi,2019,01/03/2019,"comedy, romance",126,india,hindi,laxman utekar,rohan shankar,maddock films,"kartik aaryan, kriti sanon, aparshakti khurana, pankaj tripathi, vinay pathak, atul srivastava, alka amin, vishwanath chatterjee, sapna sand, neha saraf, abhinav shukla, ajeet singh, arun singh, nabil singh",it tells the story of a television reporter in mathura who falls in love with a headstrong woman.,6.3,6299,,$ 1042905,$ 1923586,,116,11,"kartik aaryan, kriti sanon, aparshakti khurana, pan","kaj tripathi, vinay pathak, atul srivastava, alka amin, vishwanath chatterjee, sapna sand, neha saraf, abhinav shukla, ajeet singh, arun singh, nabil singh"
915,tt8912932,room 37: the mysterious death of johnny thunders,room 37: the mysterious death of johnny thunders,2019,17/05/2019,"drama, thriller",100,usa,english,"fernando cordero caballero, vicente cordero","fernando cordero caballero, vicente cordero",cleopatra entertainment,"leo ramsey, devin mcgregor ketko, timothy lee depriest, jason lasater, jonny sculls, tyler tackett, jimbo barnett, sylvain sylvain, michael jude murphy, socorro jones, robert fleet, kelly erin decker, kevin preston, prima donna, juliette james","famed rock and roll guitarist johnny thunders arrives in new orleans to get his life together after a toll of hardships, but instead falls into a dark journey and trail of events that are ...",4.2,120,,,,,13,4,"leo ramsey, devin mcgregor ketko, timothy lee depriest",", jason lasater, jonny sculls, tyler tackett, jimbo barnett, sylvain sylvain, michael jude murphy, socorro jones, robert fleet, kelly erin decker, kevin preston, prima donna, juliette james"
916,tt8914492,game over,game over,2019,2019,"drama, thriller",102,"india, turkey","tamil, telugu",ashwin saravanan,"ramkumar kaavya, suman kumar",reliance entertainment,"taapsee pannu, vinodhini vaidynathan, parvathi t., ramya subramanian, sanchana natarajan, anish kuruvilla",a nyctophobic woman has to fight her inner demons to stay alive in the game called life.,7.2,3966,,,$ 63183,,136,22,"taapsee pannu, vinodhini vaidynathan, parvathi","t., ramya subramanian, sanchana natarajan, anish kuruvilla"
917,tt8919396,muklawa,muklawa,2019,24/05/2019,drama,112,india,punjabi,simerjit singh,"upinderpal waraich, upinderpal waraich",white hill production,"ammy virk, sonam bajwa, sarabjit cheema, drishtii grewal, karamjit anmol, b.n. sharma, gurpreet ghuggi, rakhi hundal, gurpreet bhangu, sukhbir singh batth, sukhwinder chahal, parminder gill, nirmal rishi, tarsem paul, anita shabdeesh",the film is based on the after the wedding custom when a newly-wed bride is taken back to her husband's home for the first time. set against the backdrop of the pre-partitioned era.,5.9,249,,,$ 474162,,8,,"ammy virk, sonam bajwa, sarabjit cheema, drishtii","grewal, karamjit anmol, b.n. sharma, gurpreet ghuggi, rakhi hundal, gurpreet bhangu, sukhbir singh batth, sukhwinder chahal, parminder gill, nirmal rishi, tarsem paul, anita shabdeesh"
918,tt8922118,low low,low low,2019,14/02/2019,drama,92,usa,english,nick richey,nick richey,halfway crooks entertainment,"montana roesch, mike capozzi, sean carrigan, tyler chase, dominique columbus, adam elshar, trevor lee georgeson, elaine hendrix, micah howard, claude knowlton, yosef mahmood, brie mattson, mary mcneill, emmy newman, bryan michael nunez","on their last day of summer, four high-school girls confront sex, violence and their uncertain future as they struggle to reconcile a rebellious youth with impending adulthood.",4.2,160,,,,,9,4,"montana roesch, mike capozzi, sean carrigan, tyler c","hase, dominique columbus, adam elshar, trevor lee georgeson, elaine hendrix, micah howard, claude knowlton, yosef mahmood, brie mattson, mary mcneill, emmy newman, bryan michael nunez"
919,tt8922832,zui hou de ri chu,zui hou de ri chu,2019,24/02/2019,"adventure, drama, romance",103,china,mandarin,wen ren,"wen ren, elly li",,"sen yang, jue zhang, ran zhang, yue zhang","a future reliant on solar energy falls into chaos after the sun disappears, forcing a reclusive astronomer and his bubbly neighbor out of the city in search of light in the perpetual darkness.",6.5,187,$ 250000,,,,3,10,"sen yang, jue zhang, ran zhang, yue zhang",
920,tt8934918,o.p.160/18 kakshi: amminippilla,o.p.160/18 kakshi: amminippilla,2019,28/06/2019,"comedy, drama, family",135,india,malayalam,dinjith ayyathan,sanilesh sivan,zarah films,"asif ali, ahamed siddique, fara shibla, basil joseph, vijayaraghavan, srikant murali, nirmal palazhi, sudheesh, aswathy manoharan, lukman lukku, babu annur, sarasa balussery, kalesh kannattu, sivadas kannur, mammukoya",o.p.160/18 kakshi: amminippilla is an unusual court drama happening in thalassery. this realistic court drama unveils interesting case from different layers with humor and emotions.,6.5,241,,,,,3,,"asif ali, ahamed siddique, fara shibla, basil joseph",", vijayaraghavan, srikant murali, nirmal palazhi, sudheesh, aswathy manoharan, lukman lukku, babu annur, sarasa balussery, kalesh kannattu, sivadas kannur, mammukoya"
921,tt8938866,and the oskar goes to..,and the oskar goes to..,2019,21/06/2019,drama,124,"india, canada",malayalam,salim ahmed,salim ahmed,allens media,"tovino thomas, nikki rae hallow, lal, sreenivasan, zarina wahab, salim kumar, siddique, anu sithara, parvathi t., kavitha nair, morgan leblanc, sarath kumar, dinesh nair, jaffer idukki, hareesh kanaran","a real touching story of a movie maker who struggle to make his own movie passionately and sacrifice his life for his debut movie, a must watch and inspiring narration.",7.5,269,,,$ 116304,,6,1,"tovino thomas, nikki rae hallow, lal, sreenivasan, z","arina wahab, salim kumar, siddique, anu sithara, parvathi t., kavitha nair, morgan leblanc, sarath kumar, dinesh nair, jaffer idukki, hareesh kanaran"
922,tt8941422,hababam sinifi yeniden,hababam sinifi yeniden,2019,05/04/2019,comedy,106,turkey,turkish,doga can anafarta,"evren erdogan, ayse balibey tanil",hann media,"altan erkekli, toygan avanoglu, hande katipoglu, sadi celil cengiz, yusuf çim, özge özacar, giray altinok, sami aksu, nazli pinar kaya, firat albayram, irmak aydin, mustafa karaoglu, hasan say, hülya duyar, osman alkas","with this year's new students, teachers and colorful characters, the hababam class is excited about the new school year. because, private çamlica high school goes back to mixed education ...",2.3,875,,,$ 784762,,10,1,"altan erkekli, toygan avanoglu, hande katipoglu, sad","i celil cengiz, yusuf çim, özge özacar, giray altinok, sami aksu, nazli pinar kaya, firat albayram, irmak aydin, mustafa karaoglu, hasan say, hülya duyar, osman alkas"
923,tt8941440,virus,virus,2019,14/06/2019,"drama, thriller",152,india,malayalam,aashiq abu,"muhsin parari, sharfu",opm cinemas,"tovino thomas, parvathy thiruvothu, soubin shahir, madonna sebastian, revathy, asif ali, ramya nambeeshan, dileesh pothan, joju george, rahman, leona lishoy, nebula, sreenath bhasi, basil joseph, binu pappu","a real life account of the deadly nipah virus outbreak in kerala, and the courageous fight put on by several individuals which helped to contain the epidemic.",8.1,1907,,,$ 626930,,45,5,"tovino thomas, parvathy thiruvothu, soubin shah","ir, madonna sebastian, revathy, asif ali, ramya nambeeshan, dileesh pothan, joju george, rahman, leona lishoy, nebula, sreenath bhasi, basil joseph, binu pappu"
924,tt8943572,lonappante mammodheesa,lonappante mammodheesa,2019,01/02/2019,drama,136,india,malayalam,leo thaddeus,,pen & paper creations,"jayaram, shantikrishna, reshma rajan, eva pavithran, nisha sarangh, joju george, hareesh kanaran, dileesh pothan, kalabhavan niyas, kaniha, favour francis, innocent, irshad, albin jose, alencier ley lopez","lonappan happens to attend his school reunion, where he revisits his older self and starts to reflect on his potential. when he meets his friends who are doing really well in life and are happy, he starts thinking about his laid back life.",5.9,208,,,,,8,1,"jayaram, shantikrishna, reshma rajan, eva pavithra","n, nisha sarangh, joju george, hareesh kanaran, dileesh pothan, kalabhavan niyas, kaniha, favour francis, innocent, irshad, albin jose, alencier ley lopez"
925,tt8944398,aadai,aadai,2019,19/07/2019,"drama, thriller",143,india,tamil,rathna kumar,rathna kumar,v studios,"amala paul, t.m. karthik srinivasan, ramya subramanian, sriranjani, ananya ramaprasad, vivek prasanna, uma pathmanabhan, rohit nandakumar, pradeep k vijayan, bala, sarithiran, saranya ravi, karuppu nambiyaar, devaran, venkatram",a free-spirited girl gets the shock of her life when she finds herself naked in an abandoned building after a late-night party.,6.4,796,,,,,28,6,"amala paul, t.m. karthik srinivasan, ramya subram","anian, sriranjani, ananya ramaprasad, vivek prasanna, uma pathmanabhan, rohit nandakumar, pradeep k vijayan, bala, sarithiran, saranya ravi, karuppu nambiyaar, devaran, venkatram"
926,tt8946378,knives out,knives out,2019,27/11/2019,"comedy, crime, drama",130,usa,english,rian johnson,rian johnson,lionsgate,"ana de armas, chris evans, jamie lee curtis, toni collette, daniel craig, don johnson, katherine langford, lakeith stanfield, michael shannon, edi patterson, christopher plummer, jaeden martell, riki lindhome, raúl castillo, m. emmet walsh","a detective investigates the death of a patriarch of an eccentric, combative family.",6.8,1593,$ 40000000,,,84,18,83,"ana de armas, chris evans, jamie lee curtis, toni col","lette, daniel craig, don johnson, katherine langford, lakeith stanfield, michael shannon, edi patterson, christopher plummer, jaeden martell, riki lindhome, raúl castillo, m. emmet walsh"
927,tt8948208,foxtrot six,foxtrot six,2019,21/02/2019,"action, drama, sci-fi",114,"indonesia, usa",english,randy korompis,randy korompis,,"oka antara, verdi solaiman, chicco jerikho, rio dewanto, arifin putra, mike lewis, miller khan, edward akbar, julie estelle, norman r. akyuwen, cok simbara, godfred orindeod, willem bevers, aurélie moeremans, ario prabowo",a former marine and his friends struggle to save indonesia from a ruthless party leader.,7,413,,,,,34,7,"oka antara, verdi solaiman, chicco jerikho, rio dewan","to, arifin putra, mike lewis, miller khan, edward akbar, julie estelle, norman r. akyuwen, cok simbara, godfred orindeod, willem bevers, aurélie moeremans, ario prabowo"
928,tt8948790,jersey,jersey,2019,19/04/2019,"drama, sport",157,india,telugu,gowtam tinnanuri,gowtam tinnanuri,sithara entertainments,"nani, shraddha srinath, harish kalyan, ronit kamra, charan ram, viswant duddumpudi, sanusha, sathyaraj, sampath raj, shishir sharma, praveen, v. jayaprakash, rao ramesh, brahmaji, sanjay swaroop",a failed cricketer decides to revive his cricketing career in his late 30's despite everyone being skeptical of his ability to do so.,8.7,3991,,,$ 204669,,85,4,"nani, shraddha srinath, harish kalyan, ronit kamr","a, charan ram, viswant duddumpudi, sanusha, sathyaraj, sampath raj, shishir sharma, praveen, v. jayaprakash, rao ramesh, brahmaji, sanjay swaroop"
929,tt8949056,"yes, god, yes","yes, god, yes",2019,08/03/2019,drama,78,usa,english,karen maine,karen maine,maiden voyage,"christian adam, susan blackwell, alisha boe, donna lynne champlin, natalia dyer, myles evans, gavrielle anne fontanilla, zachary forsythe, gabriella garcia, riley hough, paige hullett, tre'len johnston, matt lewis, wolfgang novogratz, francesca reale","after an innocent aol chat turns racy, a catholic teenager in the early 00s discovers masturbating and struggles to suppress her new urges in the face of eternal damnation.",5.9,130,,,,,,5,"christian adam, susan blackwell, alisha boe, donn","a lynne champlin, natalia dyer, myles evans, gavrielle anne fontanilla, zachary forsythe, gabriella garcia, riley hough, paige hullett, tre'len johnston, matt lewis, wolfgang novogratz, francesca reale"
930,tt8956398,mr. & ms. rowdy,mr. & ms. rowdy,2019,22/02/2019,"comedy, thriller",146,india,malayalam,jeethu joseph,"linta jeethu, jeethu joseph",sree gokulam movies,"jeethu joseph, aparna balamurali, saikumar, manju satheesh, esther anil, vishnu govindhan, irshad, dinesh nair, shaheen siddique, naseer sankranthy, vijayaraghavan, vijay babu, kalidas jayaram, baiju v.k., ganapathi",four wannabe goons desperately looking for contract gigs end up being challenged by a lady gangster.,4.7,125,,,$ 31945,,3,,"jeethu joseph, aparna balamurali, saikumar, man","ju satheesh, esther anil, vishnu govindhan, irshad, dinesh nair, shaheen siddique, naseer sankranthy, vijayaraghavan, vijay babu, kalidas jayaram, baiju v.k., ganapathi"
931,tt8956872,valhalla,valhalla,2019,10/10/2019,"adventure, fantasy, thriller",105,"denmark, norway, sweden, iceland","english, danish",fenar ahmad,"fenar ahmad, adam august",profile pictures,"roland møller, salóme gunnarsdóttir, andreas jessen, patricia schumann, jacob lohmann, ali sivandi, stine fischer christensen, lára jóhanna jónsdóttir, dulfi al-jabouri, asbjørn krogh nissen, sanne salomonsen, reza forghani, saxo moltke-leth, cecilia loffredo, bjørn fjæstad","the viking children røskva and tjalfe embark on an adventurous journey from midgard to valhalla with the gods thor and loki. life in valhalla, however, turns out to be threatened by the ...",7.4,1127,dkk 34300000,,,,1,1,"roland møller, salóme gunnarsdóttir, andreas jessen,","patricia schumann, jacob lohmann, ali sivandi, stine fischer christensen, lára jóhanna jónsdóttir, dulfi al-jabouri, asbjørn krogh nissen, sanne salomonsen, reza forghani, saxo moltke-leth, cecilia loffredo, bjørn fjæstad"
932,tt8959820,petta,petta,2019,11/01/2019,"action, drama",171,india,tamil,karthik subbaraj,karthik subbaraj,sun pictures,"rajinikanth, vijay sethupathi, nawazuddin siddiqui, m. sasikumar, simran, trisha krishnan, megha akash, j. mahendran, bobby simha, guru somasundaram, sananth reddy, malavika mohanan, y.g. mahendran, munishkanth, aadukalam naren","though he works as a hostel warden, there is more to kaali than meets the eye. things take an interesting turn when kaali's path crosses with a group of dreaded gangsters.",7.3,6778,,,$ 1996655,,182,18,"rajinikanth, rajinikanth, vijay sethupathi, nawazuddin siddiqu","i, m. sasikumar, simran, trisha krishnan, megha akash, j. mahendran, bobby simha, guru somasundaram, sananth reddy, malavika mohanan, y.g. mahendran, munishkanth, aadukalam naren"
933,tt8960572,selvhenter,selvhenter,2019,07/03/2019,comedy,91,denmark,"danish, english, spanish, french",magnus millang,"emil millang, magnus millang",det danske filminstitut,"magnus millang, emil millang, amalie lindegård, elisabeth bonjour, lluïsa valldaura, anaïs fabre, julie rudbæk, jesper zuschlag, anders mossling, dar salim, sabina pedrós, elena vilaplana, roberta hilarius reichhardt, morten jørgensen, jordi temprado",two estranged brothers embark on a road trip through southern europe in order to bring the body of their late father back to denmark.,6.1,296,,,,,2,,"magnus millang, emil millang, amalie lindegård, el","isabeth bonjour, lluïsa valldaura, anaïs fabre, julie rudbæk, jesper zuschlag, anders mossling, dar salim, sabina pedrós, elena vilaplana, roberta hilarius reichhardt, morten jørgensen, jordi temprado"
934,tt8962472,kodathi samaksham balan vakeel,kodathi samaksham balan vakeel,2019,01/03/2019,"comedy, crime, mystery",155,india,malayalam,b. unnikrishnan,b. unnikrishnan,rd illuminations,"dileep, mamta mohandas, siddique, bindu panikkar, renji panicker, suraj venjaramoodu, aju varghese, saiju kurup, priya anand, ganesh kumar, vamsi krishna, harish uthaman, lena, arjun nandakumar, raghu",balakrishnan is a lawyer who hasn't been able to achieve much in his professional life due to his stammer. his life takes an interesting turn when his brother-in-law entrusts him with a complex case involving a rich businessman.,5.9,633,,,$ 21448,,16,2,"dileep, mamta mohandas, siddique, bindu panikkar",", renji panicker, suraj venjaramoodu, aju varghese, saiju kurup, priya anand, ganesh kumar, vamsi krishna, harish uthaman, lena, arjun nandakumar, raghu"
935,tt8963708,and then we danced,and then we danced,2019,13/09/2019,"drama, romance",113,"sweden, georgia, france",georgian,levan akin,levan akin,french quarter film,"levan gelbakhiani, bachi valishvili, ana javakishvili, giorgi tsereteli, tamar bukhnikashvili, marika gogichaishvili, kakha gogidze, levan gabrava, ana makharadze, nino gabisonia, mate khidasheli, aleko begalishvili, saba abashidze, soso abramishvili, davit abuladze",merab has been training from a young age at the national georgian ensemble with his dance partner mary. his world turns upside down when the carefree irakli arrives and becomes both his strongest rival and desire.,8.2,2715,,,$ 50542,,41,19,"levan gelbakhiani, bachi valishvili, ana javakishvi","li, giorgi tsereteli, tamar bukhnikashvili, marika gogichaishvili, kakha gogidze, levan gabrava, ana makharadze, nino gabisonia, mate khidasheli, aleko begalishvili, saba abashidze, soso abramishvili, davit abuladze"
936,tt8970448,adopt a highway,adopt a highway,2019,01/11/2019,drama,78,usa,english,logan marshall-green,logan marshall-green,divide/conquer,"ethan hawke, chris sullivan, elaine hendrix, christopher heyerdahl, betty gabriel, anne-marie johnson, chris williams, mo mcrae, diane gaeta, milauna jackson, nate mooney, dohn norwood, loni love, jorge diaz, juan gabriel pareja",an ex-felon discovers a live baby left in a dumpster.,5.9,598,,,,53,10,16,"ethan hawke, chris sullivan, elaine hendrix, chri","stopher heyerdahl, betty gabriel, anne-marie johnson, chris williams, mo mcrae, diane gaeta, milauna jackson, nate mooney, dohn norwood, loni love, jorge diaz, juan gabriel pareja"
937,tt8972442,io sono mia,io sono mia,2019,14/01/2019,biography,100,italy,italian,riccardo donna,"monica rametta, loredana bertè",eliseo cinema,"serena rossi, maurizio lastrico, lucia mascino, dajana roncione, antonio gerardi, corrado invernizzi, edoardo pesce, nina torresi, fabrizio coniglio, daniele mariani, francesca turrini, duccio camerini, gioia spaziani, simone gandolfo, samuel garofalo",the touching life story of an famous and brilliant italian singer called mia martini which ends in total failure.,7.1,142,,,,,2,4,"serena rossi, maurizio lastrico, lucia mascino, dajan","a roncione, antonio gerardi, corrado invernizzi, edoardo pesce, nina torresi, fabrizio coniglio, daniele mariani, francesca turrini, duccio camerini, gioia spaziani, simone gandolfo, samuel garofalo"
