id,imdb_title_id,title,original_title,year,date_published,genre,duration,country,language,director,writer,production_company,actors,description,avg_vote,votes,budget,usa_gross_income,worlwide_gross_income,metascore,reviews_from_users,reviews_from_critics,lead_actors,y
613,tt8072666,fagun haway,fagun haway,2019,15/02/2019,"drama, family, history",136,bangladesh,bengali,tauquir ahmed,"tito rahman, tauquir ahmed",impress telefilm,"nusrat imrose tisha, siam ahmed, yashpal sharma, afroza banu, rownaq hasan, abul hayat, saju khadem, fazlur rahman babu, shahidul alam sachchu",the film is about the language movement during 1952 in east pakistan.,7.7,209,,,,,6,1,"nusrat imrose tisha, siam ahmed, yashpal sharma,","afroza banu, rownaq hasan, abul hayat, saju khadem, fazlur rahman babu, shahidul alam sachchu"
614,tt8074340,pelikanblut,pelikanblut,2019,19/03/2020,drama,121,"germany, bulgaria",german,katrin gebbe,katrin gebbe,junafilm,"nina hoss, murathan muslu, yana marinova, daniela holtz, sebastian rudolph, samia muriel chancrin, sophie pfennigstorf, christoph jacobi, katerina lipovska, katinka auberger, dimitar banenkin, ryan rafferr, justine hirschfeld, adelia-constance ocleppo","a woman who trains police horses adopts her second child, a severely traumatised 5-year-old girl. when the girl shows violent and anti-social behaviour, her new mother becomes determined to help her.",5.9,111,,,,,,16,"nina hoss, murathan muslu, yana marinova, dani","ela holtz, sebastian rudolph, samia muriel chancrin, sophie pfennigstorf, christoph jacobi, katerina lipovska, katinka auberger, dimitar banenkin, ryan rafferr, justine hirschfeld, adelia-constance ocleppo"
615,tt8075260,someone great,someone great,2019,19/04/2019,"comedy, romance",92,usa,english,jennifer kaytin robinson,jennifer kaytin robinson,feigco entertainment,"gina rodriguez, lakeith stanfield, brittany snow, dewanda wise, michelle buteau, rebecca naomi jones, alex moffat, joe locicero, peter vack, megan haley, ben sidell, jaboukie young-white, rosario dawson, rupaul, kenneth de abrew","after a devastating break up on the eve of her cross-country move, jenny enjoys one last nyc adventure with her two best pals. someone great is a romantic comedy about love, loss, growth and the everlasting bond of female friendship.",6.2,13183,,,,63,180,35,"gina rodriguez, lakeith stanfield, brittany snow, de","wanda wise, michelle buteau, rebecca naomi jones, alex moffat, joe locicero, peter vack, megan haley, ben sidell, jaboukie young-white, rosario dawson, rupaul, kenneth de abrew"
616,tt8079248,yesterday,yesterday,2019,28/06/2019,"comedy, fantasy, music",116,"uk, russia, china, japan","english, italian, japanese",danny boyle,"jack barth, richard curtis",decibel films,"himesh patel, lily james, sophia di martino, ellise chappell, meera syal, harry michell, vincent franklin, joel fry, michael kiwanuka, karma sood, gus brown, sanjeev bhaskar, karl theobald, alexander arnold, dominic coleman",a struggling musician realizes he's the only person on earth who can remember,6.9,62132,$ 26000000,$ 73286650,$ 151286650,56,725,288,"himesh patel, lily james, sophia di martino, ellise","chappell, meera syal, harry michell, vincent franklin, joel fry, michael kiwanuka, karma sood, gus brown, sanjeev bhaskar, karl theobald, alexander arnold, dominic coleman"
617,tt8080196,fête de famille,fête de famille,2019,04/09/2019,"comedy, drama",101,"france, belgium",french,cédric kahn,"fanny burdino, samuel doux",les films du worso,"catherine deneuve, emmanuelle bercot, vincent macaigne, cédric kahn, luàna bajrami, laetitia colombani, isabel aimé gonzález-sola, alain artur, joshua rosinet, milan hatala, solal ferreira dayan, satya dusaugey, raphaël liot, teddy perrot, kahina le querrec",a mother's birthday party is interrupted by her most unpredictable daughter.,5.9,194,eur 5350000,,$ 2536386,,1,9,"catherine deneuve, emmanuelle bercot, vincent ma","caigne, cédric kahn, luàna bajrami, laetitia colombani, isabel aimé gonzález-sola, alain artur, joshua rosinet, milan hatala, solal ferreira dayan, satya dusaugey, raphaël liot, teddy perrot, kahina le querrec"
618,tt8080648,ring of silence,ring of silence,2019,16/01/2019,drama,95,usa,english,nicole bowers wallace,"nicole bowers wallace, shannon callsen",nbw films,"ava deluca-verley, brian j. o'donnell, brandon butler, jordan mckinley-hodges, bella shepard, calhoun koenig, kayden bryce, javoun baker, yassie hawkes, lauren carlini, jesse katch, tyler harding, brian heintz, alan longstreet, nikki fioretti","when a young girl falls in love with a sweet and charming stranger, she soon finds out that her fairy tale doesn't lead to wonderland, but to a far more seedy underbelly of society.",8.5,495,,,,,3,,"ava deluca-verley, brian j. o'donnell, brandon but","ler, jordan mckinley-hodges, bella shepard, calhoun koenig, kayden bryce, javoun baker, yassie hawkes, lauren carlini, jesse katch, tyler harding, brian heintz, alan longstreet, nikki fioretti"
619,tt8081566,vijay superum pournamiyum,vijay superum pournamiyum,2019,11/01/2019,"comedy, drama",135,india,malayalam,jis joy,jis joy,new surya films,"asif ali, aishwarya lekshmi, siddique, renji panicker, balu varghese, shantikrishna, joseph annamkutty jose, k.p.a.c. lalitha, devan, darshana rajendran, ajith, aniyappan, k.s. chitra, austin dan, gayathri","a young engineering student dreams of becoming a chef, much to the dismay of his family.",7.2,849,,,$ 3288,,21,4,"asif ali, aishwarya lekshmi, siddique, renji panicke","r, balu varghese, shantikrishna, joseph annamkutty jose, k.p.a.c. lalitha, devan, darshana rajendran, ajith, aniyappan, k.s. chitra, austin dan, gayathri"
620,tt8083606,rebelles,rebelles,2019,13/03/2019,comedy,87,france,french,allan mauduit,"jérémie guez, jérémie guez",albertine productions,"cécile de france, yolande moreau, audrey lamy, simon abkarian, samuel jouy, béatrice agenin, patrick ridremont, tom lecocq, valentin papoudof, michel masiero, martine vandeville, eric godon, georges kelessidis, pierre nisse, alain bellot","sandra, a young woman forced to leave the south of france to flee a violent husband. without attachment, she returned to boulogne-sur-mer, the city of her childhood which she left almost 15...",6.3,470,,,$ 7276133,,2,23,"cécile de france, yolande moreau, audrey lamy, simon","abkarian, samuel jouy, béatrice agenin, patrick ridremont, tom lecocq, valentin papoudof, michel masiero, martine vandeville, eric godon, georges kelessidis, pierre nisse, alain bellot"
621,tt8085790,little,little,2019,12/04/2019,"comedy, fantasy, romance",109,usa,english,tina gordon,"tracy oliver, tina gordon",universal pictures,"regina hall, issa rae, marsai martin, justin hartley, tracee ellis ross, tone bell, mikey day, jd mccrary, tucker meek, thalia tran, marley taylor, eva carlton, luke james, rachel dratch, christopher a. martin",a woman is transformed into her younger self at a point in her life when the pressures of adulthood become too much to bear.,5.4,6921,$ 20000000,$ 40673960,$ 48800575,49,152,65,"regina hall, issa rae, marsai martin, justin hartley",", tracee ellis ross, tone bell, mikey day, jd mccrary, tucker meek, thalia tran, marley taylor, eva carlton, luke james, rachel dratch, christopher a. martin"
622,tt8090580,noah land,noah land,2019,25/04/2019,drama,109,"turkey, germany, usa",turkish,cenk ertürk,cenk ertürk,,"ali atay, haluk bilginer, arin kusaksizoglu, mehmet özgür, hande dogandemir, ismail ay, murat dada, murat deniz, kerem alp kabul, hüseyin tas, cantürk çolak","suffering through a mid-life crisis, omer has to face the angry villagers in order to realize his estranged father's dying wish to be buried under the enshrined noah tree which his father claims to have planted half a century ago.",7.9,197,,,,,2,10,"ali atay, haluk bilginer, arin kusaksizoglu, mehme","t özgür, hande dogandemir, ismail ay, murat dada, murat deniz, kerem alp kabul, hüseyin tas, cantürk çolak"
623,tt8091652,irupathiyonnaam noottaandu,irupathiyonnaam noottaandu,2019,25/01/2019,"action, adventure, drama",163,india,malayalam,arun gopy,arun gopy,mulakuppadam films,"pranav mohanlal, rachel david, manoj k. jayan, gokul suresh, kalabhavan shajohn, tini tom, dharmajan bolgatty, shaju k.s., innocent, siddique, g. suresh kumar, nelson sooranad, harish raj, abhishek raveendran, parvathi t.",appu a surfer and restaurant owner in goa has to face many difficulties to succeed in love.,3.6,388,,,$ 160627,,15,5,"pranav mohanlal, rachel david, manoj k. jayan, goku","l suresh, kalabhavan shajohn, tini tom, dharmajan bolgatty, shaju k.s., innocent, siddique, g. suresh kumar, nelson sooranad, harish raj, abhishek raveendran, parvathi t."
624,tt8091892,gekijouban fate/stay night: heaven's feel - ii. lost butterfly,gekijouban fate/stay night: heaven's feel - ii. lost butterfly,2019,12/01/2019,"animation, drama, fantasy",117,japan,,tomonori sudô,kinoko nasu,type-moon,"yu asakawa, mai kadowaki, hiroshi kamiya, ayako kawasumi, tadahisa saizen, tomokazu seki, noriko shitaya, noriaki sugiyama, jun'ichi suwabe, masane tsukayama, kana ueda","the story focuses on the holy grail war and explores the relationship between shirou emiya and sakura matou, two teenagers participating in this conflict. the story continues immediately ...",7.8,518,,$ 420595,$ 17295864,,5,1,"yu asakawa, mai kadowaki, hiroshi kamiya, ayako kawa","sumi, tadahisa saizen, tomokazu seki, noriko shitaya, noriaki sugiyama, jun'ichi suwabe, masane tsukayama, kana ueda"
625,tt8094252,ngk,ngk,2019,31/05/2019,"action, drama",148,india,"tamil, telugu",k. selvaraghavan,k. selvaraghavan,dream warrior pictures,"suriya, sai pallavi, rakul preet singh, ponvannan, devaraj, nizhalgal ravi, ilavarasu, thalaivasal vijay, bala singh, uma pathmanabhan, vela ramamoorthy, rajkumar, gopi kannadasan, kambam meena, karthigai selvan","an educated do-gooder is forced to enter politics in order to serve the society. but, will the old guard make way and allow him to do that?",6.1,2790,,,$ 430902,,120,10,"suriya, sai pallavi, rakul preet singh, ponvannan",", devaraj, nizhalgal ravi, ilavarasu, thalaivasal vijay, bala singh, uma pathmanabhan, vela ramamoorthy, rajkumar, gopi kannadasan, kambam meena, karthigai selvan"
626,tt8095076,snu,snu,2019,07/03/2019,romance,94,portugal,portuguese,patrícia sequeira,"claudia clemente, patrícia sequeira",santa rita filmes,"inês castel-branco, pedro almendra, inês rosado, simon frankel, rodrigo tomás, maria joão pinho, nádia santos, joana lopes, sónia lisboa, mafalda lencastre, ana nave, josé leite, afonso lagarto, pedro frias, eric da silva",the story about the romance of snu abecassis and the former portuguese prime minister sá carneiro.,6.9,231,,,$ 483240,,1,5,"inês castel-branco, pedro almendra, inês rosado, sim","on frankel, rodrigo tomás, maria joão pinho, nádia santos, joana lopes, sónia lisboa, mafalda lencastre, ana nave, josé leite, afonso lagarto, pedro frias, eric da silva"
627,tt8096832,lady and the tramp,lady and the tramp,2019,12/11/2019,"adventure, comedy, drama",103,usa,english,charlie bean,"andrew bujalski, kari granlund",taylor made,"tessa thompson, justin theroux, sam elliott, ashley jensen, janelle monáe, benedict wong, clancy brown, nate 'rocket' wonder, roman gianarthur irvin, james bentley, jentel hawkins, ara storm o'keefe, aemon wolf o'keefe, thomas mann, kiersey clemons",cgi and live-action re-imagining of the 1955 disney classic.,6.5,2401,,,,48,76,19,"tessa thompson, justin theroux, sam elliott, ashle","y jensen, janelle monáe, benedict wong, clancy brown, nate 'rocket' wonder, roman gianarthur irvin, james bentley, jentel hawkins, ara storm o'keefe, aemon wolf o'keefe, thomas mann, kiersey clemons"
628,tt8098480,the refuge,the refuge,2019,26/06/2019,"crime, drama, thriller",98,usa,english,keith sutliff,keith sutliff,ks pictures,"keith sutliff, julien cesario, matthew webb, cheyenne buchanan, tom conlan, martin copping, stefanie estes, tien pham, demetrius stear, reine swart",a getaway driver finds himself in harm's way when he gets caught up in a job involving casino heist money leading to a debt over his head.,6.1,1602,,,,,42,7,"keith sutliff, julien cesario, matthew webb, chey","enne buchanan, tom conlan, martin copping, stefanie estes, tien pham, demetrius stear, reine swart"
629,tt8103160,britt-marie var här,britt-marie var här,2019,25/01/2019,"comedy, drama, sport",94,sweden,"swedish, german",tuva novotny,"anders frithiof august, fredrik backman",sf studios production ab,"pernilla august, vera vitali, peter haber, lancelot ncube, olle sarri, mahmut suvakci, anders mossling, malin levanon, cecilia milocco, nils magnusson, hans brorson, johanna westfelt, ella juliusson sturk, wilhelm siverbo, princess wesseh","britt-marie, 63 years old, has just left a 40 year old marriage and her long life as a house wife. being told she is a nagging passive aggressive aunt the new, only job, in small town borg ...",4.9,541,,$ 36549,$ 162862,53,5,19,"pernilla august, vera vitali, peter haber, lancelot","ncube, olle sarri, mahmut suvakci, anders mossling, malin levanon, cecilia milocco, nils magnusson, hans brorson, johanna westfelt, ella juliusson sturk, wilhelm siverbo, princess wesseh"
630,tt8108164,ek ladki ko dekha toh aisa laga,ek ladki ko dekha toh aisa laga,2019,01/02/2019,"comedy, drama, romance",120,india,hindi,shelly chopra dhar,"shelly chopra dhar, gazal dhaliwal",fox star studios,"sonam kapoor, anil kapoor, rajkummar rao, juhi chawla, abhishek duhan, regina cassandra, madhumalti kapoor, seema bhargava, brijendra kala, alka badola kaushal, kanwaljit singh, akshay oberoi, sandeep kapoor, teddy maurya, k.k. shukla","some love stories are not simple, sweety's is one such story. she has to contend with her over-enthusiastic family that wants to get her married, a young writer who is completely smitten by...",5.5,2969,,$ 1182636,$ 3307565,,98,17,"sonam kapoor, anil kapoor, rajkummar rao, juhi ch","awla, abhishek duhan, regina cassandra, madhumalti kapoor, seema bhargava, brijendra kala, alka badola kaushal, kanwaljit singh, akshay oberoi, sandeep kapoor, teddy maurya, k.k. shukla"
631,tt8108196,judgementall hai kya,judgementall hai kya,2019,26/07/2019,"comedy, drama, thriller",121,india,hindi,prakash kovelamudi,kanika dhillon,balaji motion pictures,"kangana ranaut, rajkummar rao, amyra dastur, amrita puri, jimmy sheirgill, karan ashar, lalit behl, hussain dalal, debtosh darjee, shubhankar das, kanika dhillon, viktorija faith, jay gandhi, allan hopwood, brijendra kala",following the story of two quirky individuals whose lives pivot between reality and illusions.,6,3358,,,$ 534878,,178,16,"kangana ranaut, rajkummar rao, amyra dastur, amrit","a puri, jimmy sheirgill, karan ashar, lalit behl, hussain dalal, debtosh darjee, shubhankar das, kanika dhillon, viktorija faith, jay gandhi, allan hopwood, brijendra kala"
632,tt8108200,sonchiriya,sonchiriya,2019,01/03/2019,"action, crime, drama",143,india,hindi,abhishek chaubey,"abhishek chaubey, sudip sharma",macguffin pictures,"sushant singh rajput, bhumi pednekar, manoj bajpayee, ranvir shorey, ashutosh rana, gagandev riar, mahesh balraj, jayesh bhargava, ram naresh diwakar, solanki diwakar, vijay kumar dogra, shreedhar dubey, harish khanna, rahul kumar ranjan, satya ranjan","set in the chambal valley, the film follows the story of a legion of dreaded, warring dacoits who once terrorized the indian heartlands.",7.5,2337,,$ 86765,$ 135413,,63,16,"sushant singh rajput, bhumi pednekar, manoj b","ajpayee, ranvir shorey, ashutosh rana, gagandev riar, mahesh balraj, jayesh bhargava, ram naresh diwakar, solanki diwakar, vijay kumar dogra, shreedhar dubey, harish khanna, rahul kumar ranjan, satya ranjan"
633,tt8108206,saand ki aankh,saand ki aankh,2019,25/10/2019,"biography, drama",146,india,hindi,tushar hiranandani,"balwinder singh janjua, balwinder singh janjua",reliance entertainment,"taapsee pannu, bhumi pednekar, prakash jha, viineet kumar, pawan chopra, raunakk bhnder, vicky kadian, trupti khamkar, nikhat khan, shaad randhawa, ankur b. saraiya, yogendra vikram singh, navneet srivastava","both over the age of 60, chandro tomar and prakashi tomar inspire other women in india when they demonstrate their expert sharpshooting skills.",8.9,1960,,,$ 95724,,103,10,"taapsee pannu, bhumi pednekar, prakash jha, vi","ineet kumar, pawan chopra, raunakk bhnder, vicky kadian, trupti khamkar, nikhat khan, shaad randhawa, ankur b. saraiya, yogendra vikram singh, navneet srivastava"
634,tt8108208,why cheat india,why cheat india,2019,18/01/2019,"crime, drama",121,india,hindi,soumik sen,mishkka shekhawat,ellipsis entertainment,"emraan hashmi, shreya dhanwanthary, snighdadeep chatterji, navneet srivastava, nanda yadav, ashmita kaur bakshi, shibani bedi, sameeksha gaur, durgesh kumar, yash nagarkoti, manuj sharma, naval shukla, vishesh srivastava, ammar taalwala","the movie focuses on existing malpractices in country's education system, the whole concept of buying your way through education, jobs and earnings. even with an evolving education system, ...",6,1901,,,$ 5926,,29,8,"emraan hashmi, shreya dhanwanthary, snighdadeep","chatterji, navneet srivastava, nanda yadav, ashmita kaur bakshi, shibani bedi, sameeksha gaur, durgesh kumar, yash nagarkoti, manuj sharma, naval shukla, vishesh srivastava, ammar taalwala"
635,tt8108268,the tashkent files,the tashkent files,2019,12/04/2019,"drama, mystery, thriller",134,india,hindi,vivek agnihotri,vivek agnihotri,sp cinecorp,"naseeruddin shah, mithun chakraborty, shweta basu prasad, pankaj tripathi, vinay pathak, mandira bedi, rajesh sharma, prakash belawadi, ankur rathee, prashantt guptha, yusuf hussain, ravi shankar jaiswal, pallavi joshi, mohan kapoor, achint kaur","the tashkent files is a thriller that revolves around the mysterious death of india's 2nd prime minister shri lal bahadur shastri and attempts to uncover if he had actually died a natural death, or, as alleged, was assassinated.",7.9,5593,,,$ 71369,,297,7,"naseeruddin shah, mithun chakraborty, shweta b","asu prasad, pankaj tripathi, vinay pathak, mandira bedi, rajesh sharma, prakash belawadi, ankur rathee, prashantt guptha, yusuf hussain, ravi shankar jaiswal, pallavi joshi, mohan kapoor, achint kaur"
636,tt8110640,in the shadow of the moon,in the shadow of the moon,2019,27/09/2019,"crime, mystery, sci-fi",115,usa,english,jim mickle,"gregory weidman, geoffrey tock",42,"boyd holbrook, cleopatra coleman, bokeem woodbine, michael c. hall, rudi dharmalingam, al maini, quincy kirkwood, sarah dugdale, rachel keller, ryan allen, tony nappo, philippa domville, tony craig, gabrielle graham, julia knope",a philadelphia police officer struggles with a lifelong obsession to track down a mysterious serial killer whose crimes defy explanation.,6.2,23354,,,,48,384,58,"boyd holbrook, cleopatra coleman, bokeem woodbine",", michael c. hall, rudi dharmalingam, al maini, quincy kirkwood, sarah dugdale, rachel keller, ryan allen, tony nappo, philippa domville, tony craig, gabrielle graham, julia knope"
637,tt8110662,mais vous êtes fous,mais vous êtes fous,2019,24/04/2019,drama,95,france,french,audrey diwan,"audrey diwan, marcia romano",rectangle productions,"pio marmaï, céline sallette, carole franck, jean-marie winling, lola rosa lavielle, keren-ann zajtelbach, maxence tual, valérie donzelli, jeanne rosa, anne loiret, laurent bateau, nailia harzoune, laurianne loisel, cécile bouillot, bruno gouery","roman loves camille as much as he loves his two daughters. but he is hiding from all of them a serious problem of addiction, which could endanger his dearest. does love have a chance to survive when trust is broken?",6.5,107,,,$ 715999,,1,2,"pio marmaï, céline sallette, carole franck, jean-mari","e winling, lola rosa lavielle, keren-ann zajtelbach, maxence tual, valérie donzelli, jeanne rosa, anne loiret, laurent bateau, nailia harzoune, laurianne loisel, cécile bouillot, bruno gouery"
638,tt8115320,planeta singli 3,planeta singli 3,2019,14/02/2019,"comedy, romance",101,poland,polish,"sam akina, michal chacinski","sam akina, michal chacinski",gigant films,"agnieszka wiedlocha, maciej stuhr, boguslaw linda, danuta stenka, maria pakulnis, piotr glowacki, weronika ksiazkiewicz, tomasz karolak, borys szyc, anna smolowik, joanna jarmolowicz, aleksandar milicevic, jakub józefowicz, jan moryc, artur steranko","tomek and ania finally decide to get married. the wedding, according to the wishes of ania, will take place at the family members of tomek with whom he has had no contact for years. it ...",5.4,348,,,$ 7935472,,,,"agnieszka wiedlocha, maciej stuhr, boguslaw linda,","danuta stenka, maria pakulnis, piotr glowacki, weronika ksiazkiewicz, tomasz karolak, borys szyc, anna smolowik, joanna jarmolowicz, aleksandar milicevic, jakub józefowicz, jan moryc, artur steranko"
639,tt8119844,bbaengban,bbaengban,2019,30/01/2019,"action, thriller",133,south korea,korean,jun-hee han,jun-hee han,,"hyo-jin kong, jun-yeol ryu, jung-suk jo, jung-ah yum, seong-bong ahn, derek chouinard, hye-jin jeon, key, hae-woon lee, hak-joo lee, sung-wook lee, ye-young park, sukku son",eun si yeon is a police officer and she was demoted to the hit-and-run task force at a police station from the regional investigation unit at the national police agency and will work ...,5.5,327,,,$ 13489165,,6,3,"hyo-jin kong, jun-yeol ryu, jung-suk jo, jung-ah","yum, seong-bong ahn, derek chouinard, hye-jin jeon, key, hae-woon lee, hak-joo lee, sung-wook lee, ye-young park, sukku son"
640,tt8128188,high flying bird,high flying bird,2019,08/02/2019,"drama, sport",90,usa,english,steven soderbergh,tarell alvin mccraney,extension 765,"andré holland, melvin gregg, eddie tavares, farah bala, skip bayless, shannon sharpe, joy taylor, zazie beetz, bill duke, zachary quinto, caleb mclaughlin, bobbi a bordley, sonja sohn, kyle maclachlan, jeryl prescott","during a pro basketball lockout, a sports agent pitches a rookie basketball client on an intriguing and controversial business proposition.",6.2,5674,$ 2000000,,,78,48,65,"andré holland, melvin gregg, eddie tavares, farah bal","a, skip bayless, shannon sharpe, joy taylor, zazie beetz, bill duke, zachary quinto, caleb mclaughlin, bobbi a bordley, sonja sohn, kyle maclachlan, jeryl prescott"
641,tt8129966,all inclusive,all inclusive,2019,13/02/2019,comedy,92,"france, belgium",french,fabien onteniente,"franck dubosc, guy laurent",curiosa films,"franck dubosc, françois-xavier demaison, josiane balasko, thierry lhermitte, amelle chahbi, caroline anglade, camille lavabre, mister v, victor belmondo, thaïs alessandrin, christophe canard, jonathan roberge, victoria olloqui, antonia de rendinger, admiral t.","planted by his fiancee at the airport, bruno flies away alone for a week in an all inclusive caribbean vacation club. bad news never comes alone, he will have to share his room with jean-paul cisse, eternal bachelor very invading .",3.1,234,,,,,2,4,"franck dubosc, françois-xavier demaison, josiane bal","asko, thierry lhermitte, amelle chahbi, caroline anglade, camille lavabre, mister v, victor belmondo, thaïs alessandrin, christophe canard, jonathan roberge, victoria olloqui, antonia de rendinger, admiral t."
642,tt8130558,one day: justice delivered,one day: justice delivered,2019,05/07/2019,"action, crime, thriller",124,india,hindi,ashok nanda,alaukik rahi,cinema friday international,"anupam kher, kumud mishra, esha gupta, zakir hussain, rajesh sharma, murli sharma, deepshika nagpal, kashyap barbhaya, saavi chauhan, nilofar gesawat, mohaq kansara, akram ali khan, irfan razaa khan, nasirr khan, ananth narayan mahadevan",a crime branch special officer investigates the serial disappearance of high profile individuals in a state capital.,6.7,593,,,$ 3340,,13,5,"anupam kher, kumud mishra, esha gupta, zakir h","ussain, rajesh sharma, murli sharma, deepshika nagpal, kashyap barbhaya, saavi chauhan, nilofar gesawat, mohaq kansara, akram ali khan, irfan razaa khan, nasirr khan, ananth narayan mahadevan"
643,tt8130968,badla,badla,2019,08/03/2019,"crime, drama, mystery",118,india,hindi,sujoy ghosh,"oriol paulo, sujoy ghosh",azure entertainment,"amitabh bachchan, taapsee pannu, amrita singh, antonio aakeel, tony luke, tanveer ghani, tariqsafdar hussain, mark mansfield, april agarwal-aplin, india agarwal-aplin, rachel flynn, jason hetherington, selina hotwani, maram kamal, manav kaul",a dynamic young entrepreneur finds herself locked in a hotel room with the corpse of her dead lover. she hires a prestigious lawyer to defend her and they work together to figure out what actually happened.,7.9,15633,,$ 1861000,$ 3590894,,378,28,"amitabh bachchan, taapsee pannu, amrita singh",", antonio aakeel, tony luke, tanveer ghani, tariqsafdar hussain, mark mansfield, april agarwal-aplin, india agarwal-aplin, rachel flynn, jason hetherington, selina hotwani, maram kamal, manav kaul"
644,tt8134742,3 from hell,3 from hell,2019,01/09/2019,horror,115,usa,"english, spanish",rob zombie,rob zombie,capital arts entertainment,"sheri moon zombie, bill moseley, sid haig, jeff daniel phillips, richard brake, kevin jackson, tracey leigh, sylvia jefferies, emilio rivera, richard edson, pancho moler, dee wallace, stacie greenwell, anny rosario, matthew willig",sequel to the devil's rejects.,5.7,6026,$ 3000000,$ 2172949,$ 2279214,50,232,87,"sheri moon zombie, bill moseley, sid haig, jeff dan","iel phillips, richard brake, kevin jackson, tracey leigh, sylvia jefferies, emilio rivera, richard edson, pancho moler, dee wallace, stacie greenwell, anny rosario, matthew willig"
